[
    {
        "domain":  "agent-persistence",
        "domainTitle":  null,
        "method":  "GET",
        "host":  "dataverse",
        "hostName":  "orgd1da6e38.crm.dynamics.com",
        "path":  "/api/data/v9.2/bots({key})",
        "count":  59,
        "purpose":  "Load the agent (bot) record.",
        "semanticId":  "cs:dv:v9:bots:get",
        "confidence":  "CONFIRMED",
        "status":  null,
        "note":  null
    },
    {
        "domain":  "agent-persistence",
        "domainTitle":  null,
        "method":  "GET",
        "host":  "dataverse",
        "hostName":  "orgd1da6e38.crm.dynamics.com",
        "path":  "/api/data/v9.2/bots",
        "count":  13,
        "purpose":  "List bots in environment.",
        "semanticId":  "cs:dv:v9:bots:get",
        "confidence":  "CONFIRMED",
        "status":  null,
        "note":  null
    },
    {
        "domain":  "agent-persistence",
        "domainTitle":  null,
        "method":  "GET",
        "host":  "dataverse",
        "hostName":  "orgd1da6e38.crm.dynamics.com",
        "path":  "/api/data/v9.2/WhoAmI",
        "count":  9,
        "purpose":  "Resolve current Dataverse user.",
        "semanticId":  "cs:dv:v9:dataverse-meta:get",
        "confidence":  "CONFIRMED",
        "status":  null,
        "note":  null
    },
    {
        "domain":  "agent-persistence",
        "domainTitle":  null,
        "method":  "GET",
        "host":  "dataverse",
        "hostName":  "orgd1da6e38.crm.dynamics.com",
        "path":  "/api/data/v9.2/solutions",
        "count":  7,
        "purpose":  "List/resolve owning solution.",
        "semanticId":  "cs:dv:v9:dataverse-meta:get",
        "confidence":  "CONFIRMED",
        "status":  null,
        "note":  null
    },
    {
        "domain":  "agent-persistence",
        "domainTitle":  null,
        "method":  "GET",
        "host":  "dataverse",
        "hostName":  "orgd1da6e38.crm.dynamics.com",
        "path":  "/api/data/v9.2/cds_userpreferredsolutions",
        "count":  5,
        "purpose":  "Resolve maker\u0027s preferred solution.",
        "semanticId":  "cs:dv:v9:dataverse-meta:get",
        "confidence":  "CONFIRMED",
        "status":  null,
        "note":  null
    },
    {
        "domain":  "agent-persistence",
        "domainTitle":  null,
        "method":  "GET",
        "host":  "dataverse",
        "hostName":  "orgd1da6e38.crm.dynamics.com",
        "path":  "/api/data/v9.2/GetPreferredSolution",
        "count":  2,
        "purpose":  "Preferred solution function.",
        "semanticId":  "cs:dv:v9:dataverse-meta:get",
        "confidence":  "CONFIRMED",
        "status":  null,
        "note":  null
    },
    {
        "domain":  "agent-persistence",
        "domainTitle":  null,
        "method":  "GET",
        "host":  "powervamg",
        "hostName":  "powervamg.us-il106.gateway.prod.island.powerapps.com",
        "path":  "/api/botmanagement/v1/environments/Default-{id}/bootstrap-settings",
        "count":  6,
        "purpose":  "Bootstrap maker session/feature flags.",
        "semanticId":  "cs:bm:settings:get",
        "confidence":  "CONFIRMED",
        "status":  null,
        "note":  null
    },
    {
        "domain":  "agent-persistence",
        "domainTitle":  null,
        "method":  "GET",
        "host":  "powervamg",
        "hostName":  "powervamg.us-il106.gateway.prod.island.powerapps.com",
        "path":  "/api/botmanagement/v1/languages",
        "count":  5,
        "purpose":  "Supported authoring languages (settings).",
        "semanticId":  "cs:bm:settings:get",
        "confidence":  "CONFIRMED",
        "status":  null,
        "note":  null
    },
    {
        "domain":  "agent-components-save",
        "domainTitle":  null,
        "method":  "POST",
        "host":  "powervamg",
        "hostName":  "powervamg.us-il106.gateway.prod.island.powerapps.com",
        "path":  "/api/botmanagement/v1/environments/Default-{id}/bots/{id}/content/botcomponents",
        "count":  41,
        "purpose":  "Create/save agent components (instructions, knowledge, skills, tools, IQ).",
        "semanticId":  "cs:bm:botcomponents:post",
        "confidence":  "CONFIRMED",
        "status":  null,
        "note":  null
    },
    {
        "domain":  "agent-components-save",
        "domainTitle":  null,
        "method":  "PUT",
        "host":  "powervamg",
        "hostName":  "powervamg.us-il106.gateway.prod.island.powerapps.com",
        "path":  "/api/botmanagement/v1/environments/Default-{id}/bots/{id}/content/botcomponents",
        "count":  6,
        "purpose":  "Update existing agent component.",
        "semanticId":  "cs:bm:botcomponents:put",
        "confidence":  "CONFIRMED",
        "status":  null,
        "note":  null
    },
    {
        "domain":  "agent-components-save",
        "domainTitle":  null,
        "method":  "GET",
        "host":  "environmentApi",
        "hostName":  "default6b104499c49f45dcb3a2df95efd6ee.b4.environment.api.powerplatform.com",
        "path":  "/connectivity/knowledgeSources",
        "count":  1,
        "purpose":  "Knowledge source catalog for Add knowledge.",
        "semanticId":  "cs:env:connectivity:get",
        "confidence":  "CONFIRMED",
        "status":  null,
        "note":  null
    },
    {
        "domain":  "agent-components-save",
        "domainTitle":  null,
        "method":  "GET",
        "host":  "environmentApi",
        "hostName":  "default6b104499c49f45dcb3a2df95efd6ee.b4.environment.api.powerplatform.com",
        "path":  "/connectivity/connectors/shared_microsoftcopilotstudio/connections",
        "count":  5,
        "purpose":  "Connector connections for tools.",
        "semanticId":  "cs:env:connectivity:get",
        "confidence":  "CONFIRMED",
        "status":  null,
        "note":  null
    },
    {
        "domain":  "agent-components-save",
        "domainTitle":  null,
        "method":  "POST",
        "host":  "environmentApi",
        "hostName":  "default6b104499c49f45dcb3a2df95efd6ee.b4.environment.api.powerplatform.com",
        "path":  "/powerautomate/operationGroups",
        "count":  8,
        "purpose":  "Power Automate operation groups (tool/workflow picker).",
        "semanticId":  "cs:env:connectivity:post",
        "confidence":  "CONFIRMED",
        "status":  null,
        "note":  null
    },
    {
        "domain":  "agent-components-save",
        "domainTitle":  null,
        "method":  "POST",
        "host":  "environmentApi",
        "hostName":  "default6b104499c49f45dcb3a2df95efd6ee.b4.environment.api.powerplatform.com",
        "path":  "/powerautomate/operations",
        "count":  4,
        "purpose":  "Power Automate operations (tool/workflow picker).",
        "semanticId":  "cs:env:connectivity:post",
        "confidence":  "CONFIRMED",
        "status":  null,
        "note":  null
    },
    {
        "domain":  "model-and-features",
        "domainTitle":  null,
        "method":  "GET",
        "host":  "powervamg",
        "hostName":  "powervamg.us-il106.gateway.prod.island.powerapps.com",
        "path":  "/chatbotmanagement/tenants/{id}/environments/Default-{id}/api/featureSettings/modelSettings/v2",
        "count":  4,
        "purpose":  "Available prompt models (e.g. Claude Sonnet 4.6).",
        "semanticId":  "cs:bm:settings:get",
        "confidence":  "CONFIRMED",
        "status":  null,
        "note":  null
    },
    {
        "domain":  "model-and-features",
        "domainTitle":  null,
        "method":  "GET",
        "host":  "powervamg",
        "hostName":  "powervamg.us-il106.gateway.prod.island.powerapps.com",
        "path":  "/chatbotmanagement/tenants/{id}/environments/Default-{id}/api/featureSettings/clientSettings",
        "count":  3,
        "purpose":  "Client feature settings.",
        "semanticId":  "cs:bm:settings:get",
        "confidence":  "CONFIRMED",
        "status":  null,
        "note":  null
    },
    {
        "domain":  "model-and-features",
        "domainTitle":  null,
        "method":  "GET",
        "host":  "environmentApi",
        "hostName":  "default6b104499c49f45dcb3a2df95efd6ee.b4.environment.api.powerplatform.com",
        "path":  "/copilotgovernance/settings/PowerPlatform_Anthropic",
        "count":  2,
        "purpose":  "Anthropic model governance gate.",
        "semanticId":  "cs:env:op:get",
        "confidence":  "CONFIRMED",
        "status":  null,
        "note":  null
    },
    {
        "domain":  "publish",
        "domainTitle":  null,
        "method":  "GET",
        "host":  "powervamg",
        "hostName":  "powervamg.us-il106.gateway.prod.island.powerapps.com",
        "path":  "/api/botmanagement/v1/environments/Default-{id}/bots/{id}/publishv2-operations",
        "count":  217,
        "purpose":  "Poll publish operation status (long-poll; dominant request by volume).",
        "semanticId":  "cs:bm:publish:get",
        "confidence":  "CONFIRMED",
        "status":  null,
        "note":  null
    },
    {
        "domain":  "publish",
        "domainTitle":  null,
        "method":  "POST",
        "host":  "powervamg",
        "hostName":  "powervamg.us-il106.gateway.prod.island.powerapps.com",
        "path":  "/api/botmanagement/v1/environments/Default-{id}/bots/{id}/publishv2-operations",
        "count":  9,
        "purpose":  "Start a publish operation (inline publish, no confirm dialog).",
        "semanticId":  "cs:bm:publish:post",
        "confidence":  "CONFIRMED",
        "status":  null,
        "note":  null
    },
    {
        "domain":  "channels-teams-m365",
        "domainTitle":  null,
        "method":  "GET",
        "host":  "environmentApi",
        "hostName":  "default6b104499c49f45dcb3a2df95efd6ee.b4.environment.api.powerplatform.com",
        "path":  "/copilotstudio/agents/{id}/channels/m365/link",
        "count":  22,
        "purpose":  "M365 channel link status.",